{
  "$schema": "../../schemas/plugin.schema.json",
  "id": "cudalister",
  "name": "CudaLister",
  "type": "WLX",
  "category": "Viewer",
  "description": "Syntax highlighting file viewer plugin based on CudaText engine (supports 200+ languages)",
  "authors": ["Alexey-T"],
  "homepage": "https://github.com/Alexey-T/CudaLister",
  "license": "MPL-2.0",
  "match": {
    "aliases": ["cudalister", "wlx_cudalister"],
    "filenames": ["cudalister.wlx", "cudalister.wlx64"]
  },
  "source": {
    "type": "github_release",
    "repo": "Alexey-T/CudaLister",
    "asset_pattern": "wlx_cudalister.*\\.zip",
    "totalcmd_id": "CudaLister"
  }
}